{
  "schema": "bcp.desired_state_resource/1",
  "api_version": "bcp/v1",
  "kind": "WindowsStartupBinding",
  "metadata": {
    "resource_id": "BCP_MICROKERNEL_STARTUP",
    "project_id": "BCP_CORE",
    "generation": 1,
    "created_at": "2026-10-05T21:45:00Z",
    "updated_at": null,
    "owner": "BCP_POLICY"
  },
  "spec": {
    "desired": {
      "primary_trigger": "HKCU_RUN",
      "legacy_scheduled_task_present": false,
      "legacy_supervisor_present": false,
      "chatgpt_pc_required_for_startup": false
    },
    "reconcile_policy": {
      "mode": "AUTO_BOUNDED_SYSTEM",
      "max_permission_class": "P3_BOUNDED_SYSTEM_CHANGE",
      "resource_ceiling": "R1_LIGHT",
      "repair_backoff_seconds": 60,
      "max_attempts_per_incident": 3
    },
    "evidence_contract": ["SERVICE_STATE", "FILE_READBACK"],
    "dependencies": []
  },
  "status": {
    "observed_generation": 0,
    "phase": "UNKNOWN",
    "last_observed_at": null,
    "last_reconciled_at": null,
    "conditions": []
  }
}
