{
  "schema": "bcp.desired_state_resource/1",
  "api_version": "bcp/v1",
  "kind": "BcpRuntime",
  "metadata": {
    "resource_id": "bcp-runtime",
    "project_id": "BCP_CORE",
    "generation": 1,
    "created_at": "2026-10-05T21:30:00Z",
    "updated_at": null,
    "owner": "BCP_POLICY"
  },
  "spec": {
    "desired": {
      "healthy": true,
      "primary_startup": "HKCU_RUN",
      "single_resident_process": true
    },
    "reconcile_policy": {
      "mode": "AUTO_SAFE",
      "max_permission_class": "P1_SAFE_WRITE",
      "resource_ceiling": "R1_LIGHT",
      "repair_backoff_seconds": 30,
      "max_attempts_per_incident": 3
    },
    "evidence_contract": ["PROCESS_HEALTH", "FILE_READBACK"],
    "dependencies": []
  },
  "status": {
    "observed_generation": 0,
    "phase": "UNKNOWN",
    "last_observed_at": null,
    "last_reconciled_at": null,
    "conditions": []
  }
}
